<?xml version="1.0" encoding="UTF-8" standalone="no"?>
<bulletins xmlns="http://caaml.org/Schemas/V6.0/Profiles/BulletinEAWS" xmlns:gml="http://www.opengis.net/gml" xmlns:xlink="http://www.w3.org/1999/xlink" xmlns:xsi="http://www.w3.org/2001/XMLSchema-instance" xsi:schemaLocation="http://caaml.org/Schemas/V6.0/Profiles/BulletinEAWS http://caaml.org/Schemas/V6.0/Profiles/BulletinEAWS/CAAMLv6_BulletinEAWS.xsd">
  <metaData>
    <extFile>
      <type>link</type>
      <description>Link to the website</description>
      <fileReferenceURI>https://avalanche.report/bulletin/2019-01-16</fileReferenceURI>
    </extFile>
    <extFile>
      <type>simple_link</type>
      <description>Link to the simplified website</description>
      <fileReferenceURI>https://avalanche.report/simple/2019-01-16/en.html</fileReferenceURI>
    </extFile>
    <extFile>
      <type>fd_albina_map.jpg</type>
      <description>Danger rating map (whole day)</description>
      <fileReferenceURI>https://avalanche.report/albina_files_local/2019-01-16/2019-01-15_16-00-00/fd_albina_map.jpg</fileReferenceURI>
    </extFile>
    <extFile>
      <type>fd_tyrol_map.jpg</type>
      <description>Danger rating map Tirol (whole day)</description>
      <fileReferenceURI>https://avalanche.report/albina_files_local/2019-01-16/2019-01-15_16-00-00/fd_tyrol_map.jpg</fileReferenceURI>
    </extFile>
    <extFile>
      <type>fd_southtyrol_map.jpg</type>
      <description>Danger rating map Southtyrol (whole day)</description>
      <fileReferenceURI>https://avalanche.report/albina_files_local/2019-01-16/2019-01-15_16-00-00/fd_southtyrol_map.jpg</fileReferenceURI>
    </extFile>
    <extFile>
      <type>fd_trentino_map.jpg</type>
      <description>Danger rating map Trentino (whole day)</description>
      <fileReferenceURI>https://avalanche.report/albina_files_local/2019-01-16/2019-01-15_16-00-00/fd_trentino_map.jpg</fileReferenceURI>
    </extFile>
    <extFile>
      <type>pdf</type>
      <description>PDF </description>
      <fileReferenceURI>https://avalanche.report/albina_files_local/2019-01-16/2019-01-15_16-00-00/2019-01-16_en.pdf</fileReferenceURI>
    </extFile>
    <extFile>
      <type>tyrol_pdf</type>
      <description>PDF Tirol </description>
      <fileReferenceURI>https://avalanche.report/albina_files_local/2019-01-16/2019-01-15_16-00-00/2019-01-16_AT-07_en.pdf</fileReferenceURI>
    </extFile>
    <extFile>
      <type>southtyrol_pdf</type>
      <description>PDF Southtyrol </description>
      <fileReferenceURI>https://avalanche.report/albina_files_local/2019-01-16/2019-01-15_16-00-00/2019-01-16_IT-32_BZen.pdf</fileReferenceURI>
    </extFile>
    <extFile>
      <type>trentino_pdf</type>
      <description>PDF Trentino </description>
      <fileReferenceURI>https://avalanche.report/albina_files_local/2019-01-16/2019-01-15_16-00-00/2019-01-16_IT-32-TN_en.pdf</fileReferenceURI>
    </extFile>
    <extFile>
      <type>am_albina_map.jpg</type>
      <description>Danger rating map (AM)</description>
      <fileReferenceURI>https://avalanche.report/albina_files_local/2019-01-16/2019-01-15_16-00-00/am_albina_map.jpg</fileReferenceURI>
    </extFile>
    <extFile>
      <type>am_tyrol_map.jpg</type>
      <description>Danger rating map Tirol (AM)</description>
      <fileReferenceURI>https://avalanche.report/albina_files_local/2019-01-16/2019-01-15_16-00-00/am_tyrol_map.jpg</fileReferenceURI>
    </extFile>
    <extFile>
      <type>am_southtyrol_map.jpg</type>
      <description>Danger rating map Southtyrol (AM)</description>
      <fileReferenceURI>https://avalanche.report/albina_files_local/2019-01-16/2019-01-15_16-00-00/am_southtyrol_map.jpg</fileReferenceURI>
    </extFile>
    <extFile>
      <type>am_trentino_map.jpg</type>
      <description>Danger rating map Trentino (AM)</description>
      <fileReferenceURI>https://avalanche.report/albina_files_local/2019-01-16/2019-01-15_16-00-00/am_trentino_map.jpg</fileReferenceURI>
    </extFile>
    <extFile>
      <type>pm_albina_map.jpg</type>
      <description>Danger rating map (PM)</description>
      <fileReferenceURI>https://avalanche.report/albina_files_local/2019-01-16/2019-01-15_16-00-00/pm_albina_map.jpg</fileReferenceURI>
    </extFile>
    <extFile>
      <type>pm_tyrol_map.jpg</type>
      <description>Danger rating map Tirol (PM)</description>
      <fileReferenceURI>https://avalanche.report/albina_files_local/2019-01-16/2019-01-15_16-00-00/pm_tyrol_map.jpg</fileReferenceURI>
    </extFile>
    <extFile>
      <type>pm_southtyrol_map.jpg</type>
      <description>Danger rating map Southtyrol (PM)</description>
      <fileReferenceURI>https://avalanche.report/albina_files_local/2019-01-16/2019-01-15_16-00-00/pm_southtyrol_map.jpg</fileReferenceURI>
    </extFile>
    <extFile>
      <type>pm_trentino_map.jpg</type>
      <description>Danger rating map Trentino (PM)</description>
      <fileReferenceURI>https://avalanche.report/albina_files_local/2019-01-16/2019-01-15_16-00-00/pm_trentino_map.jpg</fileReferenceURI>
    </extFile>
    <extFile>
      <type>am_overlay.png</type>
      <description>Danger rating overlay (AM)</description>
      <fileReferenceURI>https://avalanche.report/albina_files_local/2019-01-16/2019-01-15_16-00-00/am_overlay.png</fileReferenceURI>
    </extFile>
    <extFile>
      <type>pm_overlay.png</type>
      <description>Danger rating overlay (PM)</description>
      <fileReferenceURI>https://avalanche.report/albina_files_local/2019-01-16/2019-01-15_16-00-00/pm_overlay.png</fileReferenceURI>
    </extFile>
    <extFile>
      <type>am_regions.json</type>
      <description>GeoJSON for regions (AM)</description>
      <fileReferenceURI>https://avalanche.report/albina_files_local/2019-01-16/2019-01-15_16-00-00/am_regions.json</fileReferenceURI>
    </extFile>
    <extFile>
      <type>pm_regions.json</type>
      <description>GeoJSON for regions (PM)</description>
      <fileReferenceURI>https://avalanche.report/albina_files_local/2019-01-16/2019-01-15_16-00-00/pm_regions.json</fileReferenceURI>
    </extFile>
  </metaData>
  <bulletin id="ID_a19bd3dc-85df-448f-be5e-f88f0c14ed4f" lang="en">
    <metaData>
      <extFile>
        <type>dangerRatingMap</type>
        <description>Simplified danger rating map of the region</description>
        <fileReferenceURI>https://avalanche.report/albina_files_local/2019-01-16/2019-01-15_16-00-00/a19bd3dc-85df-448f-be5e-f88f0c14ed4f.jpg</fileReferenceURI>
      </extFile>
      <extFile>
        <type>website</type>
        <description>Link to region on the website</description>
        <fileReferenceURI>https://avalanche.report/bulletin/2019-01-16?region=a19bd3dc-85df-448f-be5e-f88f0c14ed4f</fileReferenceURI>
      </extFile>
    </metaData>
    <publicationTime>2019-01-15T16:00:00Z</publicationTime>
    <validTime>
      <startTime>2019-01-15T23:00:00Z</startTime>
      <endTime>2019-01-16T11:00:00Z</endTime>
    </validTime>
    <source>
      <operation>
        <name>Avalanche.report</name>
        <website>https://avalanche.report/</website>
      </operation>
    </source>
    <region id="IT-32-BZ-07">
      <name>Texel Mountains</name>
    </region>
    <region id="IT-32-BZ-11">
      <name>Durreck Range</name>
    </region>
    <region id="IT-32-BZ-12">
      <name>Western Rieserferner Mountains</name>
    </region>
    <region id="IT-32-BZ-01">
      <name>Val MÃ¼stair Alps</name>
    </region>
    <region id="IT-32-BZ-02">
      <name>Langtaufers</name>
    </region>
    <region id="IT-32-BZ-03">
      <name>Schnals Ridge</name>
    </region>
    <region id="IT-32-BZ-04">
      <name>Southern Stubai Alps</name>
    </region>
    <region id="IT-32-BZ-05">
      <name>Southern Zillertal Alps and High Tauern</name>
    </region>
    <complexity>easy</complexity>
    <dangerRating>
      <mainValue>considerable</mainValue>
      <elevation uom="m">
        <lowerBound>1600</lowerBound>
      </elevation>
    </dangerRating>
    <dangerRating>
      <mainValue>considerable</mainValue>
      <elevation uom="m">
        <upperBound>1600</upperBound>
      </elevation>
    </dangerRating>
    <avalancheProblem>
      <type>new_snow</type>
      <aspect>S</aspect>
      <aspect>SW</aspect>
      <aspect>W</aspect>
      <aspect>NW</aspect>
      <aspect>NE</aspect>
      <aspect>SE</aspect>
      <aspect>E</aspect>
      <aspect>N</aspect>
      <terrainFeature> Many starting zones have released the snow but not entirely.</terrainFeature>
      <matrixInformation>
        <artificialDangerRating>considerable</artificialDangerRating>
        <artificialAvalancheSize>3</artificialAvalancheSize>
        <artificialAvalancheReleaseProbability>3</artificialAvalancheReleaseProbability>
        <artificialHazardSiteDistribution>2</artificialHazardSiteDistribution>
        <naturalDangerRating>moderate</naturalDangerRating>
        <naturalAvalancheReleaseProbability>2</naturalAvalancheReleaseProbability>
        <naturalHazardSiteDistribution>1</naturalHazardSiteDistribution>
      </matrixInformation>
    </avalancheProblem>
    <avalancheProblem>
      <type>wind_drifted_snow</type>
      <aspect>S</aspect>
      <aspect>SW</aspect>
      <aspect>W</aspect>
      <aspect>NW</aspect>
      <aspect>NE</aspect>
      <aspect>SE</aspect>
      <aspect>E</aspect>
      <aspect>N</aspect>
      <matrixInformation>
        <artificialDangerRating>considerable</artificialDangerRating>
        <artificialAvalancheSize>3</artificialAvalancheSize>
        <artificialAvalancheReleaseProbability>3</artificialAvalancheReleaseProbability>
        <artificialHazardSiteDistribution>2</artificialHazardSiteDistribution>
        <naturalDangerRating>moderate</naturalDangerRating>
        <naturalAvalancheReleaseProbability>2</naturalAvalancheReleaseProbability>
        <naturalHazardSiteDistribution>1</naturalHazardSiteDistribution>
      </matrixInformation>
    </avalancheProblem>
    <tendency>
      <type>decreasing</type>
      <validTime>